static/reports/experiment_results_20250831165451_filtered.csv

Category,Metric,varianta_jdk_17 Mean,variantb_jdk_21 Mean,varianta_jdk_17 P50,variantb_jdk_21 P50,varianta_jdk_17 P90,variantb_jdk_21 P90,Unit
Build,Build time,396626,381929,391789,379035,424128,403575,ms
Build,Configuration time,44278,43845,44064,42937,47542,47701,ms
Gradle process state,Gradle-Process-gcTime,0.12,0.14,0.12,0.14,0.13,0.15,
Kotlin process state,Kotlin-Process-gcTime,0.3,0.4,0.3,0.4,0.34,0.47,
Task Type,org.jetbrains.kotlin.gradle.tasks.KotlinCompile,3790,3511,3376,3132,5957,5530,ms
Task Type,com.google.devtools.ksp.gradle.KspTaskJvm,4030,3806,3787,3572,5534,5144,ms
Task Type,com.android.build.gradle.internal.res.LinkApplicationAndroidResourcesTask,2498,2395,2534,2357,2963,2907,ms
Task Type,com.android.build.gradle.internal.tasks.DexMergingTask,4887,4929,2774,2654,11822,12328,ms
Task Type,com.android.build.gradle.internal.tasks.DexArchiveBuilderTask,1589,1478,1581,1433,1777,1836,ms
Task Path,:build-logic:convention:compileKotlin,6820,6722,6778,6688,7193,7087,ms
Task Path,:core:contact:kspDebugKotlin,6856,6711,6873,6641,7111,7238,ms
Task Path,:core:cart:kspDebugKotlin,8331,8195,8300,8117,8866,8674,ms
Task Path,:core:identity:kspDebugKotlin,6662,6442,6681,6341,7045,6979,ms
Task Path,:core:checkout:kspDebugKotlin,7447,7287,7423,7184,7801,7787,ms
Task Path,:core:checkout:compileDebugKotlin,8687,8280,8632,8173,9230,8669,ms
Task Path,:core:contact:compileDebugKotlin,9323,8785,9184,8687,9947,9260,ms
Task Path,:core:identity:compileDebugKotlin,10645,9950,10471,9817,11436,10593,ms
Task Path,:core:cart:compileDebugKotlin,11258,10356,11109,10329,12065,10775,ms
Task Path,:core:checkout:compileDebugJavaWithJavac,3457,3074,3415,3092,3826,3573,ms
Task Path,:core:login:kspDebugKotlin,5116,4540,5150,4451,5837,5303,ms
Task Path,:core:push:kspDebugKotlin,5465,5299,5335,5211,6104,5780,ms
Task Path,:core:login:compileDebugKotlin,5422,5273,5402,5194,5863,5821,ms
Task Path,:core:user:kspDebugKotlin,6410,6421,6461,6321,6872,7088,ms
Task Path,:feature:sync:kspDebugKotlin,6243,6118,6239,6079,6784,6527,ms
Task Path,:core:push:compileDebugKotlin,6833,6281,6798,6274,7381,6908,ms
Task Path,:feature:sync:compileDebugKotlin,5442,4519,5455,4524,5909,5312,ms
Task Path,:feature:search:kspDebugKotlin,5883,5016,5871,4979,6675,5866,ms
Task Path,:core:user:compileDebugKotlin,11073,9252,11046,9068,12035,10628,ms
Task Path,:feature:feed:kspDebugKotlin,5914,5109,5905,5047,6394,5748,ms
Task Path,:domain:account:kspDebugKotlin,4530,4450,4529,4327,5056,5630,ms
Task Path,:core:user:compileDebugJavaWithJavac,1256,1144,1282,1171,1480,1407,ms
Task Path,:feature:location:kspDebugKotlin,4940,4726,4954,4721,5480,5450,ms
Task Path,:domain:account:compileDebugKotlin,3784,3234,3853,3162,4170,4123,ms
Task Path,:feature:profile:kspDebugKotlin,5166,4781,5162,4686,5912,5614,ms
Task Path,:feature:network:kspDebugKotlin,4512,4119,4443,4131,4883,4552,ms
Task Path,:feature:feed:compileDebugKotlin,8529,7926,8472,8074,9344,8676,ms
Task Path,:feature:post:kspDebugKotlin,5415,5016,5333,4990,6127,5711,ms
Task Path,:feature:feed:compileDebugJavaWithJavac,1133,1090,1140,1094,1302,1225,ms
Task Path,:feature:network:compileDebugKotlin,3898,3471,3903,3461,4252,3891,ms
Task Path,:feature:profile:compileDebugKotlin,5153,4594,5122,4491,5918,5183,ms
Task Path,:domain:analytics:kspDebugKotlin,4589,4775,4496,4723,5291,5417,ms
Task Path,:feature:comment:kspDebugKotlin,5750,5689,5760,5707,6369,6189,ms
Task Path,:feature:location:compileDebugKotlin,4421,4316,4372,4382,5163,5010,ms
Task Path,:feature:post:compileDebugKotlin,8415,7543,8408,7722,9440,8059,ms
Task Path,:domain:analytics:compileDebugKotlin,4636,3937,4649,3976,5242,4589,ms
Task Path,:feature:comment:compileDebugKotlin,6642,5673,6586,5543,7417,6549,ms
Task Path,:domain:calendar:kspDebugKotlin,4632,4256,4572,4110,5293,5005,ms
Task Path,:feature:share:kspDebugKotlin,5321,4592,5186,4572,6112,5206,ms
Task Path,:feature:search:compileDebugKotlin,3861,3597,3831,3644,4540,4374,ms
Task Path,:domain:calendar:compileDebugKotlin,3813,3745,3766,3747,4566,4484,ms
Task Path,:domain:event:kspDebugKotlin,5137,5240,5015,5255,5845,5844,ms
Task Path,:feature:share:compileDebugKotlin,5712,5669,5676,5686,6446,6533,ms
Task Path,:domain:log:kspDebugKotlin,5499,5244,5427,5178,6021,6099,ms
Task Path,:domain:event:compileDebugKotlin,3380,3076,3437,3002,3889,3815,ms
Task Path,:domain:message:kspDebugKotlin,4261,4003,4196,3976,4574,4779,ms
Task Path,:domain:group:kspDebugKotlin,4551,4336,4620,4329,4983,4880,ms
Task Path,:domain:message:compileDebugKotlin,3619,3310,3648,3157,4108,4392,ms
Task Path,:domain:log:compileDebugKotlin,6492,6075,6494,5888,7227,7123,ms
Task Path,:domain:metric:kspDebugKotlin,4606,4277,4551,4263,5234,4895,ms
Task Path,:domain:group:compileDebugKotlin,5186,4620,5112,4551,5688,5715,ms
Task Path,:domain:notification:kspDebugKotlin,4169,4026,4084,4120,4984,4565,ms
Task Path,:domain:metric:compileDebugKotlin,5437,5153,5392,5137,6304,5641,ms
Task Path,:domain:report:kspDebugKotlin,4996,4551,4922,4557,5621,4955,ms
Task Path,:domain:notification:compileDebugKotlin,2784,2482,2743,2635,3372,2802,ms
Task Path,:domain:session:kspDebugKotlin,4216,3903,4149,3936,4788,4343,ms
Task Path,:domain:setting:kspDebugKotlin,5322,4734,5257,4761,6142,5042,ms
Task Path,:domain:session:compileDebugKotlin,3284,2739,3258,2655,3961,3311,ms
Task Path,:domain:status:kspDebugKotlin,4083,3583,4110,3546,4490,4001,ms
Task Path,:domain:report:compileDebugKotlin,5898,5101,5847,5060,6696,5938,ms
Task Path,:domain:status:compileDebugKotlin,3064,3106,2983,3099,3590,3792,ms
Task Path,:domain:setting:compileDebugKotlin,4271,4009,4294,4014,4839,4572,ms
Task Path,:domain:task:kspDebugKotlin,5107,5025,5064,5062,5920,5480,ms
Task Path,:repository:alarm:kspDebugKotlin,4055,3684,3916,3554,5100,4365,ms
Task Path,:repository:audio:kspDebugKotlin,4796,4414,4743,4362,5941,4966,ms
Task Path,:repository:alarm:compileDebugKotlin,2964,2787,2946,2744,3601,3469,ms
Task Path,:repository:cart-contact:kspDebugKotlin,5114,4610,4916,4550,6012,5430,ms
Task Path,:domain:task:compileDebugKotlin,5490,4945,5355,4829,6333,6191,ms
Task Path,:repository:audio:compileDebugKotlin,4900,4443,4834,4411,5906,4826,ms
Task Path,:repository:checkout-contact:kspDebugKotlin,3953,3757,3917,3712,4544,4561,ms
Task Path,:repository:cart-contact:compileDebugKotlin,5237,4655,5246,4645,5697,5273,ms
Task Path,:repository:article:kspDebugKotlin,4443,4111,4417,4071,4916,4764,ms
Task Path,:repository:comment-contact:kspDebugKotlin,3777,3747,3751,3738,4168,4307,ms
Task Path,:repository:checkout-contact:compileDebugKotlin,2798,2725,2741,2638,3104,3369,ms
Task Path,:repository:contact-contact:kspDebugKotlin,3810,3551,3790,3494,4238,4109,ms
Task Path,:repository:article:compileDebugKotlin,4201,3917,4141,3891,4763,4718,ms
Task Path,:repository:comment-contact:compileDebugKotlin,3262,2959,3156,2891,3757,3386,ms
Task Path,:repository:document:kspDebugKotlin,3858,3320,3866,3269,4427,3992,ms
Task Path,:repository:contact-contact:compileDebugKotlin,3204,2713,3256,2637,3566,3205,ms
Task Path,:repository:file:kspDebugKotlin,3877,3609,3845,3589,4436,4266,ms
Task Path,:repository:feed-contact:kspDebugKotlin,4113,3745,4057,3692,4690,4488,ms
Task Path,:repository:document:compileDebugKotlin,3877,3560,3789,3558,4482,4215,ms
Task Path,:repository:forecast:kspDebugKotlin,4923,4534,4861,4513,5568,5179,ms
Task Path,:repository:file:compileDebugKotlin,3528,3052,3432,2990,4110,3557,ms
Task Path,:repository:feed-contact:compileDebugKotlin,4735,4155,4773,4135,5211,4715,ms
Task Path,:repository:gallery:kspDebugKotlin,3736,3416,3804,3432,4303,4106,ms
Task Path,:repository:forecast:compileDebugKotlin,3719,3104,3676,3160,4481,3533,ms
Task Path,:repository:identity-contact:kspDebugKotlin,3579,3140,3586,3160,4075,3613,ms
Task Path,:repository:gallery:compileDebugKotlin,3442,2911,3372,2900,4314,3496,ms
Task Path,:repository:list:kspDebugKotlin,3920,3528,3856,3464,4365,3920,ms
Task Path,:repository:identity-contact:compileDebugKotlin,2453,2216,2389,2137,2782,2704,ms
Task Path,:repository:login-contact:kspDebugKotlin,4277,3943,4286,3828,4752,4447,ms
Task Path,:repository:list:compileDebugKotlin,3792,3462,3806,3478,4135,3862,ms
Task Path,:repository:map:kspDebugKotlin,3468,3240,3444,3227,3951,3802,ms
Task Path,:repository:media:kspDebugKotlin,3788,3360,3724,3405,4257,3749,ms
Task Path,:repository:login-contact:compileDebugKotlin,3928,3535,3890,3531,4454,4291,ms
Task Path,:repository:map:compileDebugKotlin,1947,1717,1917,1703,2172,2019,ms
Task Path,:repository:media:compileDebugKotlin,3315,3014,3240,2933,4033,3859,ms
Task Path,:repository:news:kspDebugKotlin,3816,3427,3748,3298,4626,4317,ms
Task Path,:repository:note:kspDebugKotlin,4560,4190,4350,4085,5167,4872,ms
Task Path,:repository:photo:kspDebugKotlin,4304,4098,4139,3993,4802,4830,ms
Task Path,:repository:news:compileDebugKotlin,3696,3467,3599,3401,4586,4022,ms
Task Path,:repository:playlist:kspDebugKotlin,4261,3988,4083,3935,5157,4489,ms
Task Path,:repository:photo:compileDebugKotlin,3242,2905,3130,2953,3745,3331,ms
Task Path,:repository:note:compileDebugKotlin,4380,3974,4276,4024,4974,4424,ms
Task Path,:repository:podcast:kspDebugKotlin,3821,3519,3707,3411,4246,4056,ms
Task Path,:repository:playlist:compileDebugKotlin,4373,3817,4232,3703,5386,4573,ms
Task Path,:repository:profile-contact:kspDebugKotlin,3540,3239,3405,3080,4684,3976,ms
Task Path,:repository:push-contact:kspDebugKotlin,4203,3811,3994,3670,5314,4590,ms
Task Path,:repository:podcast:compileDebugKotlin,3966,3491,3727,3444,5036,3997,ms
Task Path,:repository:profile-contact:compileDebugKotlin,2051,1952,2000,1850,2299,2474,ms
Task Path,:repository:timer:kspDebugKotlin,3944,3797,3887,3778,4516,4372,ms
Task Path,:repository:push-contact:compileDebugKotlin,2525,2358,2503,2257,2986,3009,ms
Task Path,:repository:timer:compileDebugKotlin,3580,3237,3520,3152,4148,3883,ms
Task Path,:repository:todo:kspDebugKotlin,4080,3807,3992,3745,4644,4474,ms
Task Path,:repository:user-contact:kspDebugKotlin,3693,3383,3707,3327,4082,3850,ms
Task Path,:repository:video:kspDebugKotlin,3911,3452,3841,3347,4426,4018,ms
Task Path,:repository:user-contact:compileDebugKotlin,2639,2452,2567,2321,2986,3197,ms
Task Path,:repository:weather:kspDebugKotlin,3760,3352,3643,3243,4185,4750,ms
Task Path,:repository:todo:compileDebugKotlin,4278,3757,4262,3550,4886,4546,ms
Task Path,:repository:video:compileDebugKotlin,3359,2937,3404,2792,3965,4170,ms
Task Path,:repository:weather:compileDebugKotlin,3385,3441,3409,3219,3789,4565,ms
Task Path,:model:post-contact:kspDebugKotlin,3403,3352,3277,3587,4321,4192,ms
Task Path,:model:post-contact:compileDebugKotlin,2156,1886,1982,1709,2998,2775,ms
Task Path,:entity:network-contact:kspDebugKotlin,3069,2562,2920,2459,3726,3090,ms
Task Path,:entity:sync-contact:kspDebugKotlin,3169,2637,3047,2523,3887,3265,ms
Task Path,:entity:location-contact:kspDebugKotlin,3080,2636,2976,2492,3680,3224,ms
Task Path,:entity:search-contact:kspDebugKotlin,3542,3173,3445,3045,4157,3680,ms
Task Path,:entity:sync-contact:compileDebugKotlin,2178,1959,2131,1888,2553,2522,ms
Task Path,:entity:network-contact:compileDebugKotlin,2601,2238,2482,2214,3221,2717,ms
Task Path,:entity:location-contact:compileDebugKotlin,2230,2103,2166,1957,2600,2761,ms
Task Path,:entity:search-contact:compileDebugKotlin,3587,3346,3494,3199,3821,4005,ms
Task Path,:data:account-contact:kspDebugKotlin,3623,3359,3513,3260,4303,3885,ms
Task Path,:data:message-contact:kspDebugKotlin,3580,3158,3364,3164,4417,3556,ms
Task Path,:entity:share-contact:kspDebugKotlin,3799,3468,3543,3399,4666,4109,ms
Task Path,:data:account-contact:compileDebugKotlin,2054,1736,1924,1707,2793,2105,ms
Task Path,:data:group-contact:kspDebugKotlin,3768,3390,3622,3317,4363,4018,ms
Task Path,:entity:share-contact:compileDebugKotlin,2854,2588,2681,2547,3579,3097,ms
Task Path,:data:message-contact:compileDebugKotlin,3710,3400,3609,3234,4293,4320,ms
Task Path,:data:group-contact:compileDebugKotlin,3614,3339,3504,3203,4249,4295,ms
Task Path,:data:notification-contact:kspDebugKotlin,4348,4006,4267,3870,4683,4843,ms
Task Path,:data:setting-contact:kspDebugKotlin,4127,3992,4014,4024,4575,5026,ms
Task Path,:data:session-contact:kspDebugKotlin,3962,3845,3928,3853,4300,4612,ms
Task Path,:data:notification-contact:compileDebugKotlin,4252,4050,4175,4034,4680,4691,ms
Task Path,:app:app:mergeDebugResources,3913,3815,3852,3699,4537,4610,ms
Task Path,:data:setting-contact:compileDebugKotlin,4028,3805,3996,3702,4708,4704,ms
Task Path,:data:session-contact:compileDebugKotlin,3124,2881,3076,2830,3842,3680,ms
Task Path,:api:calendar-contact:kspDebugKotlin,2887,2558,2760,2446,3647,3100,ms
Task Path,:api:alarm-contact:kspDebugKotlin,3547,3130,3403,3080,4374,3703,ms
Task Path,:api:event-contact:kspDebugKotlin,3093,2878,2965,2947,3809,3608,ms
Task Path,:api:analytics-contact:kspDebugKotlin,3513,3110,3429,2981,4281,3829,ms
Task Path,:api:calendar-contact:compileDebugKotlin,1993,1860,1960,1734,2383,2374,ms
Task Path,:api:alarm-contact:compileDebugKotlin,2184,2199,2161,2013,2531,2839,ms
Task Path,:api:event-contact:compileDebugKotlin,2704,2538,2635,2406,3144,3228,ms
Task Path,:api:analytics-contact:compileDebugKotlin,3385,3254,3356,3217,4047,3665,ms
Task Path,:api:log-contact:kspDebugKotlin,3125,2879,3051,2850,3741,3448,ms
Task Path,:api:status-contact:kspDebugKotlin,2887,2759,2884,2679,3353,3685,ms
Task Path,:api:metric-contact:kspDebugKotlin,3084,3080,2972,3040,3675,3676,ms
Task Path,:api:report-contact:kspDebugKotlin,3287,3200,3131,3221,3802,3752,ms
Task Path,:api:status-contact:compileDebugKotlin,1934,1631,1765,1580,2387,2040,ms
Task Path,:api:metric-contact:compileDebugKotlin,2678,2380,2578,2271,3210,3240,ms
Task Path,:api:log-contact:compileDebugKotlin,3955,3541,3865,3520,4509,4239,ms
Task Path,:api:report-contact:compileDebugKotlin,3839,3412,3751,3321,4718,4251,ms
Task Path,:api:task-contact:kspDebugKotlin,2597,2724,2404,2637,3337,3975,ms
Task Path,:api:task-contact:compileDebugKotlin,2536,2270,2477,2197,2890,2987,ms
Task Path,:app:app:processDebugResources,2498,2395,2534,2357,2963,2907,ms
Task Path,:presentation:list-contact:kspDebugKotlin,3697,3463,3649,3420,4395,4040,ms
Task Path,:presentation:podcast-contact:kspDebugKotlin,3347,3318,3325,3303,3824,3928,ms
Task Path,:presentation:file-contact:kspDebugKotlin,3326,3318,3276,3272,3830,4093,ms
Task Path,:presentation:timer-contact:kspDebugKotlin,3419,3357,3416,3297,3903,4007,ms
Task Path,:presentation:podcast-contact:compileDebugKotlin,2892,2704,2847,2683,3361,3185,ms
Task Path,:presentation:file-contact:compileDebugKotlin,2947,2698,2904,2676,3432,3167,ms
Task Path,:presentation:list-contact:compileDebugKotlin,3870,3780,3765,3799,4374,4470,ms
Task Path,:presentation:timer-contact:compileDebugKotlin,3193,3076,3167,3005,3508,3804,ms
Task Path,:presentation:todo-contact:kspDebugKotlin,3911,3968,3897,4006,4815,4804,ms
Task Path,:presentation:video-contact:kspDebugKotlin,3391,3304,3385,3287,3967,3736,ms
Task Path,:presentation:article-contact:kspDebugKotlin,3064,2913,2961,2877,3737,3432,ms
Task Path,:presentation:weather-contact:kspDebugKotlin,3779,3622,3685,3503,4434,4398,ms
Task Path,:presentation:todo-contact:compileDebugKotlin,3721,3535,3693,3340,4269,4287,ms
Task Path,:presentation:article-contact:compileDebugKotlin,1980,1893,1956,1771,2181,2461,ms
Task Path,:presentation:video-contact:compileDebugKotlin,3547,3399,3460,3311,4164,4139,ms
Task Path,:presentation:weather-contact:compileDebugKotlin,3809,3560,3808,3386,4297,4409,ms
Task Path,:presentation:forecast-contact:kspDebugKotlin,3457,3239,3495,3172,4051,4081,ms
Task Path,:presentation:map-contact:kspDebugKotlin,3503,3475,3475,3328,3846,4445,ms
Task Path,:presentation:note-contact:kspDebugKotlin,3305,3147,3303,3161,3765,3650,ms
Task Path,:presentation:forecast-contact:compileDebugKotlin,3170,3272,3121,3206,3596,3883,ms
Task Path,:ui:account-login:kspDebugKotlin,3133,3190,3157,3128,3508,3813,ms
Task Path,:presentation:note-contact:compileDebugKotlin,1788,1710,1756,1655,2032,1955,ms
Task Path,:presentation:map-contact:compileDebugKotlin,3503,3188,3503,3128,3919,3755,ms
Task Path,:ui:account-login:compileDebugKotlin,2028,1916,1959,1938,2398,2197,ms
Task Path,:ui:cart-login:kspDebugKotlin,3180,3226,3166,3118,3633,3997,ms
Task Path,:ui:audio-contact:kspDebugKotlin,3142,3078,3122,2870,3582,3977,ms
Task Path,:ui:cart-login:compileDebugKotlin,2579,2378,2525,2177,3249,3190,ms
Task Path,:presentation:document-contact:kspDebugKotlin,3210,2996,3314,3030,3683,3516,ms
Task Path,:presentation:news-contact:kspDebugKotlin,3530,3551,3464,3444,3934,4330,ms
Task Path,:ui:audio-contact:compileDebugKotlin,2710,2515,2605,2389,3615,3245,ms
Task Path,:presentation:news-contact:compileDebugKotlin,2765,2563,2723,2364,3362,3519,ms
Task Path,:ui:comment-login:kspDebugKotlin,2987,2905,2914,2879,3589,3481,ms
Task Path,:presentation:document-contact:compileDebugKotlin,3565,3569,3568,3308,3759,4383,ms
Task Path,:ui:gallery-contact:kspDebugKotlin,3572,3481,3490,3336,4486,4173,ms
Task Path,:ui:comment-login:compileDebugKotlin,2658,2589,2528,2476,3516,3189,ms
Task Path,:ui:checkout-login:kspDebugKotlin,2890,2898,2806,2927,3803,3503,ms
Task Path,:ui:feed-login:kspDebugKotlin,3480,3527,3361,3511,3965,4075,ms
Task Path,:ui:contact-login:kspDebugKotlin,3856,3805,3777,3832,4325,4341,ms
Task Path,:ui:gallery-contact:compileDebugKotlin,2049,2084,1996,1933,2399,2907,ms
Task Path,:ui:checkout-login:compileDebugKotlin,1928,1977,1865,1848,2251,2624,ms
Task Path,:ui:contact-login:compileDebugKotlin,2983,2975,3002,2870,3379,3530,ms
Task Path,:ui:feed-login:compileDebugKotlin,3539,3332,3502,3333,4239,3983,ms
Task Path,:ui:identity-login:kspDebugKotlin,2980,2848,2948,2884,3375,3286,ms
Task Path,:ui:group-login:kspDebugKotlin,3520,3340,3500,3309,4371,3952,ms
Task Path,:ui:identity-login:compileDebugKotlin,1710,1632,1625,1544,2239,2140,ms
Task Path,:ui:group-login:compileDebugKotlin,2193,2188,2151,2020,2429,2916,ms
Task Path,:ui:login-login:kspDebugKotlin,3004,2791,2888,2676,3623,3281,ms
Task Path,:ui:location-login:kspDebugKotlin,3439,3239,3321,3121,3967,3891,ms
Task Path,:ui:login-login:compileDebugKotlin,2058,2021,2002,1853,2511,2622,ms
Task Path,:ui:media-contact:kspDebugKotlin,3733,3395,3668,3308,4377,4009,ms
Task Path,:ui:location-login:compileDebugKotlin,3099,2994,3062,2885,3701,3685,ms
Task Path,:ui:message-login:kspDebugKotlin,3689,3406,3604,3282,4363,4019,ms
Task Path,:ui:network-login:kspDebugKotlin,3253,3221,3232,3116,3712,3838,ms
Task Path,:ui:media-contact:compileDebugKotlin,3005,2911,2938,2833,3454,3508,ms
Task Path,:ui:message-login:compileDebugKotlin,3298,3221,3223,3161,3740,3755,ms
Task Path,:ui:network-login:compileDebugKotlin,1813,1804,1767,1687,2122,2587,ms
Task Path,:ui:notification-login:kspDebugKotlin,3362,3329,3285,3181,3844,4295,ms
Task Path,:ui:photo-contact:kspDebugKotlin,2863,2742,2815,2721,3295,3239,ms
Task Path,:ui:notification-login:compileDebugKotlin,2594,2504,2529,2383,3097,3003,ms
Task Path,:ui:photo-contact:compileDebugKotlin,1579,1502,1496,1401,2118,2210,ms
Task Path,:ui:post-login:kspDebugKotlin,2869,2796,2845,2739,3410,3312,ms
Task Path,:ui:playlist-contact:kspDebugKotlin,2924,2911,2878,2836,3347,3379,ms
Task Path,:ui:post-login:compileDebugKotlin,2071,1941,1965,1848,2617,2601,ms
Task Path,:ui:playlist-contact:compileDebugKotlin,2096,1936,1915,1858,2593,2598,ms
Task Path,:ui:profile-login:kspDebugKotlin,3069,2924,3061,2900,3648,3555,ms
Task Path,:ui:push-login:kspDebugKotlin,3394,3211,3374,3104,4094,3794,ms
Task Path,:ui:profile-login:compileDebugKotlin,1897,1914,1850,1785,2225,2418,ms
Task Path,:ui:setting-login:kspDebugKotlin,3150,3175,3122,3035,3491,3869,ms
Task Path,:ui:search-login:kspDebugKotlin,3293,3237,3319,3069,3501,4102,ms
Task Path,:ui:push-login:compileDebugKotlin,3333,3440,3298,3260,3607,4154,ms
Task Path,:ui:search-login:compileDebugKotlin,1653,1740,1681,1544,1824,2551,ms
Task Path,:ui:setting-login:compileDebugKotlin,2520,2498,2510,2356,2741,3305,ms
Task Path,:ui:share-login:kspDebugKotlin,3286,3326,3257,3166,3557,3982,ms
Task Path,:ui:sync-login:kspDebugKotlin,3411,3538,3426,3515,3706,4294,ms
Task Path,:ui:share-login:compileDebugKotlin,3029,3240,3048,3210,3423,4011,ms
Task Path,:ui:user-login:kspDebugKotlin,3920,4092,3952,3958,4322,4803,ms
Task Path,:ui:sync-login:compileDebugKotlin,3534,3548,3452,3411,4029,4438,ms
Task Path,:ui:user-login:compileDebugKotlin,3462,3441,3398,3340,4038,4174,ms
Task Path,:app:app:kspDebugKotlin,3284,3287,3236,3094,3858,4342,ms
Task Path,:app:app:compileDebugKotlin,4812,4777,4821,4470,5265,5875,ms
Task Path,:app:app:mergeExtDexDebug,11483,11733,11555,11679,12177,12833,ms
Task Path,:app:app:hiltJavaCompileDebug,10164,10161,9940,9985,11296,10967,ms
Task Path,:app:app:mergeDebugJavaResource,1865,1803,1871,1791,2096,2146,ms
Task Path,:app:app:dexBuilderDebug,1589,1478,1581,1433,1777,1836,ms
Task Path,:app:app:mergeLibDexDebug,2794,2660,2774,2654,3021,3063,ms
All processes cpu,Max,100.0,100.0,100.0,100.0,100,100,%
All processes memory,Max,10.31,10.84,10.15,10.76,11.03,11.67,Gb
Build process cpu,Max,96.23333333333333,96.4,96.0,96.0,97,97,%
Build processes memory,Max,5.16,5.27,5.0,5.21,5.74,5.73,Gb
Build child processes cpu,Max,95.23333333333333,95.3,95.0,95.0,96,96,%
Build child processes memory,Max,4.23,4.67,4.19,4.75,4.49,5.17,Gb
gc-gradle_gc.log,total-collections,131.0,139.0,131.5,141.5,163.6,155.9,

content/posts/2025-08-31-cdsap-211-experiment.md

### 5. CPU & Memory Usage Analysis

- **All Processes:**
  - CPU: Maxed at 100% for both variants.
  - Memory: `varianta_jdk_17` = Max 10.31 GB, `variantb_jdk_21` = Max 10.84 GB

- **Build Process:**
  - CPU: `varianta_jdk_17` = 96.23%, `variantb_jdk_21` = 96.4%
  - Memory: `varianta_jdk_17` = Max 5.16 GB, `variantb_jdk_21` = Max 5.27 GB

- **Build Child Processes:**
  - CPU: `varianta_jdk_17` = 95.23%, `variantb_jdk_21` = 95.3%
  - Memory: `varianta_jdk_17` = Max 4.23 GB, `variantb_jdk_21` = Max 4.67 GB