static/reports/experiment_results_20260523100604_filtered.csv

Category,Metric,varianta_baseline Mean,variantb_kotlin-2.3.21 Mean,varianta_baseline P50,variantb_kotlin-2.3.21 P50,varianta_baseline P90,variantb_kotlin-2.3.21 P90,Unit
Build,Build time,265725,270138,264847,271717,285050,289119,ms
Build,Configuration time,40455,38658,40044,38566,45854,42180,ms
Task Type,org.jetbrains.kotlin.gradle.tasks.KotlinCompile,3209,3435,2730,2738,5221,5169,ms
Task Type,com.google.devtools.ksp.gradle.KspAATask,2512,2514,2193,2200,3585,3659,ms
Task Type,com.android.build.gradle.internal.res.LinkApplicationAndroidResourcesTask,2032,2107,2001,2056,2505,2586,ms
Task Type,com.android.build.gradle.internal.tasks.DexArchiveBuilderTask,1483,1672,1435,1702,1945,2272,ms
Task Type,com.android.build.gradle.internal.tasks.DexMergingTask,4996,5109,1114,1000,14157,14753,ms
Task Path,:build-logic:convention:compileKotlin,8092,7978,8114,7983,8721,8381,ms
Task Path,:app:app:parseDebugLocalResources,1453,1559,1141,1194,3049,3327,ms
Task Path,:core:contact:kspDebugKotlin,7163,6904,7173,6900,7552,7349,ms
Task Path,:core:cart:kspDebugKotlin,8229,7957,8162,7959,8717,8339,ms
Task Path,:core:checkout:kspDebugKotlin,7893,7621,7829,7629,8515,8172,ms
Task Path,:core:comment:kspDebugKotlin,7590,7312,7483,7256,8289,7878,ms
Task Path,:core:cart:compileDebugKotlin,8528,14151,8500,14080,9296,15142,ms
Task Path,:core:comment:compileDebugKotlin,8168,13681,8218,13572,8766,14581,ms
Task Path,:core:checkout:compileDebugKotlin,8230,13764,8264,13648,8845,14632,ms
Task Path,:core:contact:compileDebugKotlin,8298,13775,8447,13821,8857,14536,ms
Task Path,:core:feed:kspDebugKotlin,2673,2609,2701,2634,3241,3034,ms
Task Path,:core:group:kspDebugKotlin,3863,3810,3861,3693,4529,4533,ms
Task Path,:core:location:kspDebugKotlin,3929,3824,3859,3742,4353,4422,ms
Task Path,:core:identity:kspDebugKotlin,4211,4036,4097,4043,4910,4671,ms
Task Path,:core:feed:compileDebugKotlin,6478,6777,6405,6675,7341,7734,ms
Task Path,:core:location:compileDebugKotlin,5201,5069,5200,4976,5926,5901,ms
Task Path,:core:login:kspDebugKotlin,2978,2987,3014,2960,3405,3619,ms
Task Path,:core:group:compileDebugKotlin,5821,5502,5768,5542,6575,6253,ms
Task Path,:core:identity:compileDebugKotlin,5533,5293,5540,5428,6082,5998,ms
Task Path,:core:message:kspDebugKotlin,3318,3558,3265,3596,3965,4137,ms
Task Path,:core:network:kspDebugKotlin,3200,3529,3207,3667,3830,4151,ms
Task Path,:core:login:compileDebugKotlin,5162,5430,5221,5690,5987,6012,ms
Task Path,:core:notification:kspDebugKotlin,3190,3544,3168,3498,3825,4261,ms
Task Path,:core:post:kspDebugKotlin,2915,2749,2918,2750,3486,3219,ms
Task Path,:core:message:compileDebugKotlin,4992,4776,5066,4821,5703,5479,ms
Task Path,:core:network:compileDebugKotlin,4978,4923,5029,4887,5627,5564,ms
Task Path,:core:notification:compileDebugKotlin,4885,4711,4922,4697,5610,5354,ms
Task Path,:core:post:compileDebugKotlin,4646,4712,4560,4647,5326,5735,ms
Task Path,:core:profile:kspDebugKotlin,3371,3190,3329,3246,4133,3911,ms
Task Path,:core:push:kspDebugKotlin,3174,3084,3230,3058,3905,3678,ms
Task Path,:core:search:kspDebugKotlin,3326,3274,3258,3282,4100,3817,ms
Task Path,:core:setting:kspDebugKotlin,3398,3643,3298,3716,4052,4448,ms
Task Path,:core:profile:compileDebugKotlin,4947,4733,4990,4785,5851,5355,ms
Task Path,:core:push:compileDebugKotlin,4706,4626,4801,4583,5322,5449,ms
Task Path,:core:search:compileDebugKotlin,4500,4318,4450,4378,5003,5218,ms
Task Path,:core:setting:compileDebugKotlin,3841,4160,3758,4220,4709,5080,ms
Task Path,:core:share:kspDebugKotlin,2860,2849,2814,2899,3577,3355,ms
Task Path,:core:user:kspDebugKotlin,2859,2834,2884,2767,3351,3360,ms
Task Path,:feature:alarm:kspDebugKotlin,2714,2544,2725,2447,3363,3363,ms
Task Path,:core:sync:kspDebugKotlin,3752,3873,3720,3830,4679,4483,ms
Task Path,:core:share:compileDebugKotlin,4100,4200,4127,4126,4673,5249,ms
Task Path,:core:user:compileDebugKotlin,3779,3947,3791,4004,4261,4430,ms
Task Path,:core:sync:compileDebugKotlin,3600,3784,3704,3680,4166,4536,ms
Task Path,:feature:alarm:compileDebugKotlin,3438,3638,3423,3675,4190,4087,ms
Task Path,:feature:document:kspDebugKotlin,2375,2342,2324,2377,2940,2997,ms
Task Path,:feature:account:kspDebugKotlin,2455,2467,2426,2479,3071,2834,ms
Task Path,:feature:analytics:kspDebugKotlin,2335,2447,2271,2469,2940,2855,ms
Task Path,:feature:calendar:kspDebugKotlin,2481,2494,2441,2487,2897,3024,ms
Task Path,:feature:document:compileDebugKotlin,3219,3269,3157,3230,4143,4008,ms
Task Path,:feature:account:compileDebugKotlin,3238,3480,3172,3462,3876,4133,ms
Task Path,:feature:analytics:compileDebugKotlin,3368,3562,3344,3463,4056,4486,ms
Task Path,:feature:calendar:compileDebugKotlin,3215,3473,3115,3395,3786,4173,ms
Task Path,:feature:event:kspDebugKotlin,2756,3093,2773,2944,3316,3979,ms
Task Path,:feature:file:kspDebugKotlin,2158,2291,2126,2293,2687,2766,ms
Task Path,:feature:event:compileDebugKotlin,3204,3168,3225,3138,3750,3904,ms
Task Path,:feature:list:kspDebugKotlin,2300,2298,2256,2240,2944,2977,ms
Task Path,:feature:forecast:kspDebugKotlin,3241,3327,3292,3334,3875,3965,ms
Task Path,:feature:file:compileDebugKotlin,3217,3186,3132,3201,3808,3706,ms
Task Path,:feature:log:kspDebugKotlin,2597,2770,2601,2703,3342,3541,ms
Task Path,:feature:list:compileDebugKotlin,3126,3162,3057,3055,3860,3989,ms
Task Path,:feature:forecast:compileDebugKotlin,2938,3061,2986,3102,3569,3681,ms
Task Path,:feature:log:compileDebugKotlin,3153,2937,3132,2873,4171,3634,ms
Task Path,:feature:map:kspDebugKotlin,1985,2135,1997,2069,2497,2695,ms
Task Path,:feature:metric:kspDebugKotlin,2143,2177,2180,2135,2690,2705,ms
Task Path,:feature:report:kspDebugKotlin,2158,2310,2191,2273,2531,2982,ms
Task Path,:feature:status:kspDebugKotlin,1729,1996,1692,1873,2239,2936,ms
Task Path,:feature:map:compileDebugKotlin,3237,3229,3187,3216,3906,3969,ms
Task Path,:feature:metric:compileDebugKotlin,2918,3016,2807,2987,3620,3792,ms
Task Path,:feature:report:compileDebugKotlin,2936,3005,2931,2923,3580,3798,ms
Task Path,:feature:status:compileDebugKotlin,3050,3026,2961,2921,3623,3714,ms
Task Path,:feature:task:kspDebugKotlin,2013,2151,1930,2021,2602,3007,ms
Task Path,:feature:timer:kspDebugKotlin,2182,2165,2109,2016,2764,2904,ms
Task Path,:feature:weather:kspDebugKotlin,2175,2064,2238,2016,2753,2603,ms
Task Path,:feature:session:kspDebugKotlin,2181,2228,2127,2176,2778,2863,ms
Task Path,:feature:task:compileDebugKotlin,2985,2953,2888,2804,3794,3529,ms
Task Path,:feature:timer:compileDebugKotlin,2791,3037,2710,2977,3622,3842,ms
Task Path,:feature:weather:compileDebugKotlin,2558,2876,2473,2811,3221,3649,ms
Task Path,:feature:session:compileDebugKotlin,3170,3134,3095,3116,3943,3601,ms
Task Path,:domain:article:kspDebugKotlin,2284,2215,2290,2245,3019,2666,ms
Task Path,:feature:todo:kspDebugKotlin,2536,2470,2493,2509,3150,2987,ms
Task Path,:feature:note:kspDebugKotlin,3133,3030,2995,2983,3743,3832,ms
Task Path,:domain:comment-contact:kspDebugKotlin,2269,2206,2158,2262,3044,2865,ms
Task Path,:domain:article:compileDebugKotlin,3086,2988,2918,2965,3760,3692,ms
Task Path,:feature:todo:compileDebugKotlin,3069,3134,2945,3201,3927,3685,ms
Task Path,:feature:note:compileDebugKotlin,2962,2964,2885,2908,3781,3479,ms
Task Path,:domain:comment-contact:compileDebugKotlin,2847,2875,2852,2773,3454,3423,ms
Task Path,:domain:audio:kspDebugKotlin,2241,2104,2245,2014,2751,2832,ms
Task Path,:domain:contact-contact:kspDebugKotlin,1972,2038,1906,1952,2708,2692,ms
Task Path,:domain:checkout-contact:kspDebugKotlin,2377,2185,2287,2091,3150,2787,ms
Task Path,:domain:cart-contact:kspDebugKotlin,3040,2867,2888,2872,3752,3470,ms
Task Path,:domain:audio:compileDebugKotlin,2899,2978,2842,3018,3479,3694,ms
Task Path,:domain:contact-contact:compileDebugKotlin,2747,2666,2792,2675,3140,3177,ms
Task Path,:domain:checkout-contact:compileDebugKotlin,2700,2724,2721,2747,3330,3175,ms
Task Path,:domain:cart-contact:compileDebugKotlin,2742,2800,2804,2804,3293,3222,ms
Task Path,:domain:feed-contact:kspDebugKotlin,1996,1983,2037,1978,2401,2404,ms
Task Path,:domain:gallery:kspDebugKotlin,2093,2213,2077,2241,2607,2845,ms
Task Path,:domain:identity-contact:kspDebugKotlin,2215,2241,2248,2174,2715,2853,ms
Task Path,:domain:login-contact:kspDebugKotlin,2064,2183,2053,2168,2577,2685,ms
Task Path,:domain:feed-contact:compileDebugKotlin,2884,2868,2931,2803,3426,3301,ms
Task Path,:domain:gallery:compileDebugKotlin,2898,2823,3009,2822,3220,3369,ms
Task Path,:domain:identity-contact:compileDebugKotlin,2809,2781,2793,2828,3288,3354,ms
Task Path,:domain:login-contact:compileDebugKotlin,2814,2676,2843,2677,3308,3238,ms
Task Path,:domain:media:kspDebugKotlin,2052,2079,1992,2155,2691,2481,ms
Task Path,:domain:news:kspDebugKotlin,2141,2033,2145,2063,2545,2420,ms
Task Path,:domain:media:compileDebugKotlin,2918,2764,2913,2768,3876,3286,ms
Task Path,:domain:playlist:kspDebugKotlin,2045,2041,2020,1938,2589,2761,ms
Task Path,:domain:photo:kspDebugKotlin,2786,2698,2814,2693,3276,3142,ms
Task Path,:domain:news:compileDebugKotlin,2977,2880,2994,2892,3489,3651,ms
Task Path,:domain:podcast:kspDebugKotlin,2027,1895,2007,1808,2432,2471,ms
Task Path,:domain:photo:compileDebugKotlin,2667,2700,2512,2690,3348,3484,ms
Task Path,:domain:playlist:compileDebugKotlin,2861,2787,2775,2770,3510,3355,ms
Task Path,:domain:podcast:compileDebugKotlin,2817,2772,2768,2721,3623,3421,ms
Task Path,:domain:profile-contact:kspDebugKotlin,2110,2007,2126,1970,2503,2520,ms
Task Path,:domain:post-contact:kspDebugKotlin,2761,2553,2732,2438,3319,3131,ms
Task Path,:domain:push-contact:kspDebugKotlin,2826,2692,2760,2678,3726,3348,ms
Task Path,:domain:user-contact:kspDebugKotlin,2078,2057,2058,2045,2586,2576,ms
Task Path,:domain:profile-contact:compileDebugKotlin,2722,2678,2769,2677,3483,3298,ms
Task Path,:domain:post-contact:compileDebugKotlin,2648,2613,2615,2674,3235,3378,ms
Task Path,:domain:push-contact:compileDebugKotlin,2630,2616,2654,2510,3014,3584,ms
Task Path,:domain:user-contact:compileDebugKotlin,2611,2561,2547,2556,3323,3176,ms
Task Path,:domain:video:kspDebugKotlin,1980,2029,2037,2014,2451,2503,ms
Task Path,:domain:video:compileDebugKotlin,2401,2470,2359,2430,2896,2931,ms
Task Path,:repository:analytics-contact:kspDebugKotlin,1975,2090,1984,2055,2457,2614,ms
Task Path,:repository:calendar-contact:kspDebugKotlin,1963,2045,1939,2030,2474,2753,ms
Task Path,:repository:group-contact:kspDebugKotlin,2058,2058,2052,1977,2705,2666,ms
Task Path,:repository:analytics-contact:compileDebugKotlin,2638,2382,2617,2449,3047,2646,ms
Task Path,:repository:calendar-contact:compileDebugKotlin,2596,2264,2601,2259,3196,2671,ms
Task Path,:repository:account-contact:kspDebugKotlin,2648,2457,2708,2372,3361,2975,ms
Task Path,:repository:alarm-contact:kspDebugKotlin,2579,2468,2535,2432,3072,3129,ms
Task Path,:repository:location-contact:kspDebugKotlin,1670,1747,1622,1764,2102,2280,ms
Task Path,:repository:account-contact:compileDebugKotlin,2559,2585,2560,2497,3037,3307,ms
Task Path,:repository:group-contact:compileDebugKotlin,2297,2190,2193,2227,2810,2722,ms
Task Path,:repository:alarm-contact:compileDebugKotlin,2354,2435,2266,2470,2843,3014,ms
Task Path,:repository:location-contact:compileDebugKotlin,2244,2298,2181,2290,2932,2709,ms
Task Path,:repository:log-contact:kspDebugKotlin,1741,1738,1720,1592,2162,2344,ms
Task Path,:repository:message-contact:kspDebugKotlin,1757,1721,1782,1694,2142,2207,ms
Task Path,:repository:metric-contact:kspDebugKotlin,1806,1878,1687,1883,2179,2197,ms
Task Path,:repository:network-contact:kspDebugKotlin,1721,1787,1730,1753,2184,2246,ms
Task Path,:repository:log-contact:compileDebugKotlin,2359,2326,2411,2266,2843,2994,ms
Task Path,:repository:message-contact:compileDebugKotlin,2303,2426,2272,2429,2786,2946,ms
Task Path,:repository:metric-contact:compileDebugKotlin,2281,2363,2190,2375,2735,2837,ms
Task Path,:repository:network-contact:compileDebugKotlin,2122,2150,2102,1993,2639,2783,ms
Task Path,:repository:notification-contact:kspDebugKotlin,1779,1843,1697,1807,2232,2359,ms
Task Path,:repository:report-contact:kspDebugKotlin,1613,1655,1626,1655,1962,2080,ms
Task Path,:repository:search-contact:kspDebugKotlin,1728,1694,1677,1648,2155,2036,ms
Task Path,:repository:session-contact:kspDebugKotlin,1747,1726,1757,1728,2274,2296,ms
Task Path,:repository:notification-contact:compileDebugKotlin,2182,2128,2195,2063,2722,2653,ms
Task Path,:repository:report-contact:compileDebugKotlin,2192,2256,2117,2263,2690,2621,ms
Task Path,:repository:search-contact:compileDebugKotlin,2251,2266,2214,2285,2795,2721,ms
Task Path,:repository:session-contact:compileDebugKotlin,2382,2195,2443,2187,2954,2779,ms
Task Path,:repository:setting-contact:kspDebugKotlin,1747,1696,1765,1677,2152,2174,ms
Task Path,:repository:sync-contact:kspDebugKotlin,1802,1877,1808,1794,2351,2469,ms
Task Path,:repository:share-contact:kspDebugKotlin,2320,2288,2386,2199,2729,2972,ms
Task Path,:repository:status-contact:kspDebugKotlin,2404,2369,2411,2335,2711,2980,ms
Task Path,:repository:setting-contact:compileDebugKotlin,2108,2144,2045,2060,2799,2672,ms
Task Path,:repository:sync-contact:compileDebugKotlin,2418,2280,2337,2236,3349,3105,ms
Task Path,:repository:share-contact:compileDebugKotlin,2363,2290,2291,2196,2810,3034,ms
Task Path,:repository:status-contact:compileDebugKotlin,2353,2213,2314,2200,2924,2779,ms
Task Path,:repository:task-contact:kspDebugKotlin,1785,1743,1735,1639,2226,2316,ms
Task Path,:repository:task-contact:compileDebugKotlin,2347,2184,2379,2143,2658,2842,ms
Task Path,:repository:event-contact:kspDebugKotlin,1765,1839,1778,1759,2110,2502,ms
Task Path,:model:document-contact:kspDebugKotlin,1787,1834,1773,1697,2249,2377,ms
Task Path,:model:contact-login:kspDebugKotlin,2426,2404,2316,2375,2957,3111,ms
Task Path,:model:article-contact:kspDebugKotlin,1790,1904,1794,1924,2193,2376,ms
Task Path,:model:document-contact:compileDebugKotlin,2379,2446,2347,2480,3031,3106,ms
Task Path,:repository:event-contact:compileDebugKotlin,2289,2383,2144,2409,2713,2952,ms
Task Path,:model:contact-login:compileDebugKotlin,2222,2278,2272,2317,2802,2883,ms
Task Path,:model:article-contact:compileDebugKotlin,2312,2375,2299,2436,2795,2908,ms
Task Path,:model:audio-contact:kspDebugKotlin,1654,1571,1673,1629,2167,1927,ms
Task Path,:model:file-contact:kspDebugKotlin,1637,1624,1641,1627,2057,1997,ms
Task Path,:model:forecast-contact:kspDebugKotlin,1717,1800,1740,1740,2174,2287,ms
Task Path,:model:gallery-contact:kspDebugKotlin,2272,2309,2188,2232,2820,2871,ms
Task Path,:model:audio-contact:compileDebugKotlin,2196,2362,2202,2363,2731,2832,ms
Task Path,:model:file-contact:compileDebugKotlin,2157,2326,2070,2294,2715,2694,ms
Task Path,:model:forecast-contact:compileDebugKotlin,2181,2251,2164,2170,2641,2797,ms
Task Path,:model:gallery-contact:compileDebugKotlin,2022,2092,2006,2082,2467,2684,ms
Task Path,:model:list-contact:kspDebugKotlin,1613,1585,1615,1482,2084,2162,ms
Task Path,:model:map-contact:kspDebugKotlin,1532,1582,1477,1530,1942,2097,ms
Task Path,:model:media-contact:kspDebugKotlin,1613,1737,1489,1665,2080,2192,ms
Task Path,:model:list-contact:compileDebugKotlin,2140,2108,2117,2120,2531,2468,ms
Task Path,:model:news-contact:kspDebugKotlin,2149,2173,2076,2127,2614,2669,ms
Task Path,:model:map-contact:compileDebugKotlin,2012,2060,1977,1953,2602,2724,ms
Task Path,:model:media-contact:compileDebugKotlin,2030,2097,2032,2075,2416,2535,ms
Task Path,:model:note-contact:kspDebugKotlin,1701,1704,1650,1690,2204,2030,ms
Task Path,:model:news-contact:compileDebugKotlin,1975,2038,2006,1984,2480,2374,ms
Task Path,:model:note-contact:compileDebugKotlin,1989,2014,1920,2005,2487,2469,ms
Task Path,:model:photo-contact:kspDebugKotlin,1492,1515,1516,1547,1815,1882,ms
Task Path,:model:playlist-contact:kspDebugKotlin,1492,1586,1461,1621,1872,1952,ms
Task Path,:model:podcast-contact:kspDebugKotlin,1659,1780,1645,1734,2220,2170,ms
Task Path,:model:push-login:kspDebugKotlin,1637,1684,1602,1647,2247,2118,ms
Task Path,:model:playlist-contact:compileDebugKotlin,1909,2136,1874,2123,2457,2630,ms
Task Path,:model:photo-contact:compileDebugKotlin,2016,2054,1984,2060,2379,2413,ms
Task Path,:model:podcast-contact:compileDebugKotlin,2123,2102,2185,1988,2504,2642,ms
Task Path,:model:push-login:compileDebugKotlin,1975,1934,2062,1857,2405,2568,ms
Task Path,:model:timer-contact:kspDebugKotlin,1673,1593,1723,1578,2143,2071,ms
Task Path,:model:video-contact:kspDebugKotlin,1571,1589,1511,1537,1954,2136,ms
Task Path,:model:todo-contact:kspDebugKotlin,2037,2030,2030,1944,2421,2592,ms
Task Path,:model:weather-contact:kspDebugKotlin,1652,1665,1597,1638,2021,2129,ms
Task Path,:model:timer-contact:compileDebugKotlin,1927,1880,1969,1884,2333,2401,ms
Task Path,:model:video-contact:compileDebugKotlin,2053,2019,2021,1980,2548,2530,ms
Task Path,:model:weather-contact:compileDebugKotlin,2061,2074,2027,1996,2642,2511,ms
Task Path,:model:todo-contact:compileDebugKotlin,1945,2009,1895,1960,2509,2545,ms
Task Path,:app:app:kspDebugKotlin,3120,3176,3169,3236,3760,4020,ms
Task Path,:app:app:mergeDebugResources,4666,4834,4634,4883,5512,5695,ms
Task Path,:app:app:compileDebugKotlin,3121,3350,3132,3405,3710,4042,ms
Task Path,:app:app:hiltJavaCompileDebug,3537,3602,3345,3304,3924,5990,ms
Task Path,:app:app:processDebugResources,2032,2107,2001,2056,2505,2586,ms
Task Path,:app:app:mergeDebugJavaResource,2322,2580,2314,2625,2784,3189,ms
Task Path,:app:app:dexBuilderDebug,1483,1672,1435,1702,1945,2272,ms
Task Path,:app:app:mergeExtDexDebug,13474,13932,13625,14411,14738,15294,ms
Task Path,:app:app:mergeLibDexDebug,1107,1036,1102,1000,1405,1330,ms
All processes cpu,Max,100.0,100.0,100.0,100.0,100,100,%
All processes memory,Max,8.28,8.81,8.31,8.94,8.79,9.33,Gb
Build process cpu,Max,96.2,96.13333333333334,96.0,96.0,97,97,%
Build processes memory,Max,4.04,4.12,4.03,4.14,4.49,4.72,Gb
Build child processes cpu,Max,93.3,94.46666666666667,93.5,95.0,95,96,%
Build child processes memory,Max,3.19,3.65,3.16,3.66,3.35,3.89,Gb

content/posts/2026-05-23-cdsap-317-experiment.md

### 4. CPU & Memory Usage Analysis

- **All Processes:**
  - CPU: Max usage remained at 100% for both variants.
  - Memory: Max increased from 8.28 GB to 8.81 GB in `variantb_kotlin-2.3.21`.

- **Build Process:**
  - CPU: Max usage slightly decreased from 96.2% to 96.133%.
  - Memory: Increased from 4.04 GB to 4.12 GB.